"","titles","authors","subjects","abstracts","metadata"
"111","deep leakage from gradients","yaqiong mu","cryptography and security (cs.cr)","with the development of artificial intelligence technology, federated learning (fl) model has been widely used in many industries for its high efficiency and confidentiality. some researchers have explored its confidentiality and designed some algorithms to attack training data sets, but these algorithms all have their own limitations. therefore, most people still believe that local machine learning gradient information is safe and reliable. in this paper, an algorithm based on gradient features is designed to attack the federated learning model in order to attract more attention to the security of federated learning systems. in federated learning system, gradient contains little information compared with the original training data set, but this project intends to restore the original training image data through gradient information. convolutional neural network (cnn) has excellent performance in image processing. therefore, the federated learning model of this project is equipped with convolutional neural network structure, and the model is trained by using image data sets. the algorithm calculates the virtual gradient by generating virtual image labels. then the virtual gradient is matched with the real gradient to restore the original image. this attack algorithm is written in python language, uses cat and dog classification kaggle data sets, and gradually extends from the full connection layer to the convolution layer, thus improving the universality. at present, the average squared error between the data recovered by this algorithm and the original image information is approximately 5, and the vast majority of images can be completely restored according to the gradient information given, indicating that the gradient of federated learning system is not absolutely safe and reliable.","thu, 15 dec 2022 08:06:46 utc (737 kb)"
"112","exploring levels of control for a navigation assistant for blind travelers","vinitha ranganeni, mike sinclair, eyal ofek, amos miller, jonathan campbell, andrey kolobov, edward cutrell","robotics (cs.ro)","only a small percentage of blind and low-vision people use traditional mobility aids such as a cane or a guide dog. various assistive technologies have been proposed to address the limitations of traditional mobility aids. these devices often give either the user or the device majority of the control. in this work, we explore how varying levels of control affect the users' sense of agency, trust in the device, confidence, and successful navigation. we present glide, a novel mobility aid with two modes for control: glide-directed and user-directed. we employ glide in a study (n=9) in which blind or low-vision participants used both modes to navigate through an indoor environment. overall, participants found that glide was easy to use and learn. most participants trusted glide despite its current limitations, and their confidence and performance increased as they continued to use glide. users' control mode preference varied in different situations; no single mode ""won"" in all situations.","thu, 5 jan 2023 23:55:49 utc (18,023 kb)"
"113","e-inu: simulating a quadruped robot with emotional sentience","abhiruph chakravarty, jatin karthik tripathy, sibi chakkaravarthy s, aswani kumar cherukuri, s. anitha, firuz kamalov, annapurna jonnalagadda","robotics (cs.ro)","quadruped robots are currently used in industrial robotics as mechanical aid to automate several routine tasks. however, presently, the usage of such a robot in a domestic setting is still very much a part of the research. this paper discusses the understanding and virtual simulation of such a robot capable of detecting and understanding human emotions, generating its gait, and responding via sounds and expression on a screen. to this end, we use a combination of reinforcement learning and software engineering concepts to simulate a quadruped robot that can understand emotions, navigate through various terrains and detect sound sources, and respond to emotions using audio-visual feedback. this paper aims to establish the framework of simulating a quadruped robot that is emotionally intelligent and can primarily respond to audio-visual stimuli using motor or audio response. the emotion detection from the speech was not as performant as eranns or zeta policy learning, still managing an accuracy of 63.5%. the video emotion detection system produced results that are almost at par with the state of the art, with an accuracy of 99.66%. due to its ""on-policy"" learning process, the ppo algorithm was extremely rapid to learn, allowing the simulated dog to demonstrate a remarkably seamless gait across the different cadences and variations. this enabled the quadruped robot to respond to generated stimuli, allowing us to conclude that it functions as predicted and satisfies the aim of this work.","tue, 3 jan 2023 06:28:45 utc (863 kb)"
"114","foreground-background separation through concept distillation from generative image foundation models","mischa dombrowski, hadrien reynaud, matthew baugh, bernhard kainz","computer vision and pattern recognition (cs.cv)","curating datasets for object segmentation is a difficult task. with the advent of large-scale pre-trained generative models, conditional image generation has been given a significant boost in result quality and ease of use. in this paper, we present a novel method that enables the generation of general foreground-background segmentation models from simple textual descriptions, without requiring segmentation labels. we leverage and explore pre-trained latent diffusion models, to automatically generate weak segmentation masks for concepts and objects. the masks are then used to fine-tune the diffusion model on an inpainting task, which enables fine-grained removal of the object, while at the same time providing a synthetic foreground and background dataset. we demonstrate that using this method beats previous methods in both discriminative and generative performance and closes the gap with fully supervised training while requiring no pixel-wise object labels. we show results on the task of segmenting four different objects (humans, dogs, cars, birds) and a use case scenario in medical image analysis. the code is available at this https url.","thu, 29 dec 2022 13:51:54 utc (39,715 kb)[v2] mon, 4 sep 2023 07:44:31 utc (18,058 kb)"
"115","cats vs dogs, photons vs hadrons","francesco visconti","instrumentation and methods for astrophysics (astro-ph.im)","in gamma ray astronomy with cherenkov telescopes, machine learning models are needed to guess what kind of particles generated the detected light, and their energies and directions. the focus in this work is on the classification task, training a simple convolutional neural network suitable for binary classification (as it could be a cats vs dogs classification problem), using as input uncleaned images generated by montecarlo data for a single astri telescope. results show an enhanced discriminant power with respect to classical random forest methods.","fri, 16 dec 2022 09:50:23 utc (118 kb)"
"116","auxiliary learning as a step towards artificial general intelligence","christeen t. jose","artificial intelligence (cs.ai)","auxiliary learning is a machine learning approach in which the model acknowledges the existence of objects that do not come under any of its learned categories.the name auxiliary learning was chosen due to the introduction of an auxiliary class. the paper focuses on increasing the generality of existing narrow purpose neural networks and also highlights the need to handle unknown objects. the cat & dog binary classifier is taken as an example throughout the paper.","wed, 30 nov 2022 19:04:50 utc (47 kb)"
"117","extreme nature of four blue-excess dust-obscured galaxies revealed by optical spectroscopy","akatoki noboriguchi, tohru nagao, yoshiki toba, kohei ichikawa, masaru kajisawa, nanako kato, toshihiro kawaguchi, hideo matsuhara, yoshiki matsuoka, kyoko onishi, masafusa onoue, nozomu tamada, koki terao, yuichi terashima, yoshihiro ueda, takuji yamashita","astrophysics of galaxies (astro-ph.ga)","we report optical spectroscopic observations of four blue-excess dust-obscured galaxies (bludogs) identified by subaru hyper suprime-cam. bludogs are a sub-class of dust-obscured galaxies (dogs, defined with the extremely red color $(i-[22])_{\rm ab} \geq 7.0$; toba et al. 2015), showing a significant flux excess in the optical $g$- and $r$-bands over the power-law fits to the fluxes at the longer wavelengths. noboriguchi et al. (2019) has suggested that bludogs may correspond to the blowing-out phase involved in a gas-rich major merger scenario. however the detailed properties of bludogs are not understood because of the lack of spectroscopic information. in this work, we carry out deep optical spectroscopic observations of four bludogs using subaru/focas and vlt/fors2. the obtained spectra show broad emission lines with extremely large equivalent widths, and a blue wing in the civ line profile. the redshifts are between 2.2 and 3.3. the averaged rest-frame equivalent widths of the civ lines are $160\pm33$ $\mathrm{\mathring{a}}$, $\sim$7 times higher than the average of a typical type-1 quasar. the fwhms of their velocity profiles are between 1990 and 4470 ${\rm km\ s^{-1}}$, and their asymmetric parameters are 0.05 and 0.25. such strong civ lines significantly affect the broad-band magnitudes, which is partly the origin of the blue excess seen in the spectral energy distribution of bludogs. their estimated supermassive black hole masses are $1.1\times10^8 < m_{\rm bh}/m_\odot < 5.5 \times 10^8$. the inferred eddington ratios of the bludogs are higher than 1 ($1.1< \lambda_{\rm edd} < 3.8$), suggesting that the bludogs are in a rapidly evolving phase of supermassive black holes.","wed, 30 nov 2022 05:31:16 utc (1,525 kb)"
"118","data augmentation vision transformer for fine-grained image classification","chao hu, liqiang zhu, weibin qiu, weijie wu","computer vision and pattern recognition (cs.cv)","recently, the vision transformer (vit) has made breakthroughs in image recognition. its self-attention mechanism (msa) can extract discriminative labeling information of different pixel blocks to improve image classification accuracy. however, the classification marks in their deep layers tend to ignore local features between layers. in addition, the embedding layer will be fixed-size pixel blocks. input network inevitably introduces additional image noise. to this end, we study a data augmentation vision transformer (davt) based on data augmentation and proposes a data augmentation method for attention cropping, which uses attention weights as the guide to crop images and improve the ability of the network to learn critical features. secondly, we also propose a hierarchical attention selection (has) method, which improves the ability of discriminative markers between levels of learning by filtering and fusing labels between levels. experimental results show that the accuracy of this method on the two general datasets, cub-200-2011, and stanford dogs, is better than the existing mainstream methods, and its accuracy is 1.4\% and 1.6\% higher than the original vit, respectively","wed, 23 nov 2022 11:34:11 utc (3,347 kb)[v2] thu, 24 nov 2022 08:40:56 utc (3,347 kb)"
"119","detect only what you specify : object detection with linguistic target","moyuru yamada","computer vision and pattern recognition (cs.cv)","object detection is a computer vision task of predicting a set of bounding boxes and category labels for each object of interest in a given image. the category is related to a linguistic symbol such as 'dog' or 'person' and there should be relationships among them. however the object detector only learns to classify the categories and does not treat them as the linguistic symbols. multi-modal models often use the pre-trained object detector to extract object features from the image, but the models are separated from the detector and the extracted visual features does not change with their linguistic input. we rethink the object detection as a vision-and-language reasoning task. we then propose targeted detection task, where detection targets are given by a natural language and the goal of the task is to detect only all the target objects in a given image. there are no detection if the target is not given. commonly used modern object detectors have many hand-designed components like anchor and it is difficult to fuse the textual inputs into the complex pipeline. we thus propose language-targeted detector (ltd) for the targeted detection based on a recently proposed transformer-based detector. ltd is a encoder-decoder architecture and our conditional decoder allows the model to reason about the encoded image with the textual input as the linguistic context. we evaluate detection performances of ltd on coco object detection dataset and also show that our model improves the detection results with the textual input grounding to the visual object.","fri, 18 nov 2022 07:28:47 utc (1,880 kb)"
"120","c3: cross-instance guided contrastive clustering","mohammadreza sadeghi, hadi hojjati, narges armanfard","machine learning (cs.lg)","clustering is the task of gathering similar data samples into clusters without using any predefined labels. it has been widely studied in machine learning literature, and recent advancements in deep learning have revived interest in this field. contrastive clustering (cc) models are a staple of deep clustering in which positive and negative pairs of each data instance are generated through data augmentation. cc models aim to learn a feature space where instance-level and cluster-level representations of positive pairs are grouped together. despite improving the sota, these algorithms ignore the cross-instance patterns, which carry essential information for improving clustering performance. this increases the false-negative-pair rate of the model while decreasing its true-positive-pair rate. in this paper, we propose a novel contrastive clustering method, cross-instance guided contrastive clustering (c3), that considers the cross-sample relationships to increase the number of positive pairs and mitigate the impact of false negative, noise, and anomaly sample on the learned representation of data. in particular, we define a new loss function that identifies similar instances using the instance-level representation and encourages them to aggregate together. moreover, we propose a novel weighting method to select negative samples in a more efficient way. extensive experimental evaluations show that our proposed method can outperform state-of-the-art algorithms on benchmark computer vision datasets: we improve the clustering accuracy by 6.6%, 3.3%, 5.0%, 1.3% and 0.3% on cifar-10, cifar-100, imagenet-10, imagenet-dogs, and tiny-imagenet.","mon, 14 nov 2022 06:28:07 utc (1,123 kb)[v2] mon, 21 nov 2022 22:39:07 utc (1,124 kb)[v3] fri, 21 jul 2023 21:49:20 utc (22,445 kb)[v4] fri, 1 sep 2023 04:27:44 utc (22,445 kb)"
"121","elliptically-contoured tensor-variate distributions with application to improved image learning","carlos llosa-vite, ranjan maitra","methodology (stat.me)","statistical analysis of tensor-valued data has largely used the tensor-variate normal (tvn) distribution that may be inadequate when data comes from distributions with heavier or lighter tails. we study a general family of elliptically contoured (ec) tensor-variate distributions and derive its characterizations, moments, marginal and conditional distributions, and the ec wishart distribution. we describe procedures for maximum likelihood estimation from data that are (1) uncorrelated draws from an ec distribution, (2) from a scale mixture of the tvn distribution, and (3) from an underlying but unknown ec distribution, where we extend tyler's robust estimator. a detailed simulation study highlights the benefits of choosing an ec distribution over the tvn for heavier-tailed data. we develop tensor-variate classification rules using discriminant analysis and ec errors and show that they better predict cats and dogs from images in the animal faces-hq dataset than the tvn-based rules. a novel tensor-on-tensor regression and tensor-variate analysis of variance (tanova) framework under ec errors is also demonstrated to better characterize gender, age and ethnic origin than the usual tvn-based tanova in the celebrated labeled faces of the wild dataset.","sun, 13 nov 2022 16:20:47 utc (5,635 kb)"
"122","spontaneous stable rotation of flocking flexible active matter","gaoxiao jiang, zhihong you, rui ma, chen-xu wu","soft condensed matter (cond-mat.soft)","in nature, active matter, such as worms or dogs, tend to spontaneously form a stable rotational cluster when they flock to the same food source on an unregulated and unconfined surface. {in this paper we present an $n$-node flexible active matter model to study the collective motion due to the flocking of individual agents on a two-dimensional surface, and confirm that there exists a spontaneous stable cluster rotation synchronizing with a chirality produced by the alignment of their bodies under the impetus of the active force.} a prefactor of 1.86 is obtained for the linear relationship between normalized angular velocity and chirality. the angular velocity of such a rotation is found to be dependent on the individual flexibility, the number of nodes in each individual, and the magnitude of the active force. the conclusions well explain the spontaneous stable rotation of clusters that exists in many flexible active matter, like worms or {dogs}, when they flock to the same single source.","thu, 10 nov 2022 04:31:53 utc (7,461 kb)[v2] wed, 16 aug 2023 20:16:01 utc (2,203 kb)"
"123","common pets in 3d: dynamic new-view synthesis of real-life deformable categories","samarth sinha, roman shapovalov, jeremy reizenstein, ignacio rocco, natalia neverova, andrea vedaldi, david novotny","computer vision and pattern recognition (cs.cv)","obtaining photorealistic reconstructions of objects from sparse views is inherently ambiguous and can only be achieved by learning suitable reconstruction priors. earlier works on sparse rigid object reconstruction successfully learned such priors from large datasets such as co3d. in this paper, we extend this approach to dynamic objects. we use cats and dogs as a representative example and introduce common pets in 3d (cop3d), a collection of crowd-sourced videos showing around 4,200 distinct pets. cop3d is one of the first large-scale datasets for benchmarking non-rigid 3d reconstruction ""in the wild"". we also propose tracker-nerf, a method for learning 4d reconstruction from our dataset. at test time, given a small number of video frames of an unseen object, tracker-nerf predicts the trajectories of its 3d points and generates new views, interpolating viewpoint and time. results on cop3d reveal significantly better non-rigid new-view synthesis performance than existing baselines.","mon, 7 nov 2022 22:42:42 utc (9,638 kb)"
"124","contact-free simultaneous sensing of human heart rate and canine breathing rate for animal assisted interactions","timothy holder, mushfiqur rahman, emily summers, david roberts, chau-wai wong, alper bozkurt","signal processing (eess.sp)","animal assisted interventions (aais) involve pleasant interactions between humans and animals and can potentially benefit both types of participants. research in this field may help to uncover universal insights about cross-species bonding, dynamic affect detection, and the influence of environmental factors on dyadic interactions. however, experiments evaluating these outcomes are limited to methodologies that are qualitative, subjective, and cumbersome due to the ergonomic challenges related to attaching sensors to the body. current approaches in aais also face challenges when translating beyond controlled clinical environments or research contexts. these also often neglect the measurements from the animal throughout the interaction. here, we present our preliminary effort toward a contact-free approach to facilitate aai assessment via the physiological sensing of humans and canines using consumer-grade cameras. this initial effort focuses on verifying the technological feasibility of remotely sensing the heart rate signal of the human subject and the breathing rate signal of the dog subject while they are interacting. small amounts of motion such as patting and involuntary body shaking or movement can be tolerated with our custom designed vision-based algorithms. the experimental results show that the physiological measurements obtained by our algorithms were consistent with those provided by the standard reference devices. with further validation and expansion to other physiological parameters, the presented approach offers great promise for many scenarios from the aai research space to veterinary, surgical, and clinical applications.","mon, 7 nov 2022 15:47:31 utc (1,266 kb)[v2] fri, 11 nov 2022 20:03:05 utc (1,266 kb)"
"125","on the informativeness of supervision signals","ilia sucholutsky, ruairidh m. battleday, katherine m. collins, raja marjieh, joshua c. peterson, pulkit singh, umang bhatt, nori jacoby, adrian weller, thomas l. griffiths","machine learning (cs.lg)","supervised learning typically focuses on learning transferable representations from training examples annotated by humans. while rich annotations (like soft labels) carry more information than sparse annotations (like hard labels), they are also more expensive to collect. for example, while hard labels only provide information about the closest class an object belongs to (e.g., ""this is a dog""), soft labels provide information about the object's relationship with multiple classes (e.g., ""this is most likely a dog, but it could also be a wolf or a coyote""). we use information theory to compare how a number of commonly-used supervision signals contribute to representation-learning performance, as well as how their capacity is affected by factors such as the number of labels, classes, dimensions, and noise. our framework provides theoretical justification for using hard labels in the big-data regime, but richer supervision signals for few-shot learning and out-of-distribution generalization. we validate these results empirically in a series of experiments with over 1 million crowdsourced image annotations and conduct a cost-benefit analysis to establish a tradeoff curve that enables users to optimize the cost of supervising representation learning on their own datasets.","wed, 2 nov 2022 18:02:31 utc (2,674 kb)[v2] thu, 22 jun 2023 19:04:25 utc (8,470 kb)[v3] tue, 4 jul 2023 15:25:05 utc (8,470 kb)"
"126","multi-vector retrieval as sparse alignment","yujie qian, jinhyuk lee, sai meher karthik duddu, zhuyun dai, siddhartha brahma, iftekhar naim, tao lei, vincent y. zhao","computation and language (cs.cl)","multi-vector retrieval models improve over single-vector dual encoders on many information retrieval tasks. in this paper, we cast the multi-vector retrieval problem as sparse alignment between query and document tokens. we propose aligner, a novel multi-vector retrieval model that learns sparsified pairwise alignments between query and document tokens (e.g. `dog' vs. `puppy') and per-token unary saliences reflecting their relative importance for retrieval. we show that controlling the sparsity of pairwise token alignments often brings significant performance gains. while most factoid questions focusing on a specific part of a document require a smaller number of alignments, others requiring a broader understanding of a document favor a larger number of alignments. unary saliences, on the other hand, decide whether a token ever needs to be aligned with others for retrieval (e.g. `kind' from `kind of currency is used in new zealand}'). with sparsified unary saliences, we are able to prune a large number of query and document token vectors and improve the efficiency of multi-vector retrieval. we learn the sparse unary saliences with entropy-regularized linear programming, which outperforms other methods to achieve sparsity. in a zero-shot setting, aligner scores 51.1 points ndcg@10, achieving a new retriever-only state-of-the-art on 13 tasks in the beir benchmark. in addition, adapting pairwise alignments with a few examples (<= 8) further improves the performance up to 15.7 points ndcg@10 for argument retrieval tasks. the unary saliences of aligner helps us to keep only 20% of the document token representations with minimal performance loss. we further show that our model often produces interpretable alignments and significantly improves its performance when initialized from larger language models.","wed, 2 nov 2022 16:49:58 utc (696 kb)"
