"","titles","authors","subjects","abstracts","metadata"
"65","important clues that facilitate visual emergence: three psychological experiments","jingmeng li, hui wei","neurons and cognition (q-bio.nc)","visual emergence is the phenomenon in which the visual system obtains a holistic perception after grouping and reorganizing local signals. the picture dalmatian dog is known for its use in explaining visual emergence. this type of image, which consists of a set of discrete black speckles (speckles), is called an emerging image. not everyone can find the dog in dalmatian dog, and among those who can, the time spent varies greatly. although gestalt theory summarizes perceptual organization into several principles, it remains ambiguous how these principles affect the perception of emerging images. this study, therefore, designed three psychological experiments to explore the factors that influence the perception of emerging images. in the first, we found that the density of speckles in the local area and the arrangements of some key speckles played a key role in the perception of an emerging case. we set parameters in the algorithm to characterize these two factors. we then automatically generated diversified emerging-test images (etis) through the algorithm and verified their effectiveness in two subsequent experiments.","mon, 10 jul 2023 13:46:43 utc (3,650 kb)"
"66","an overdensity of lyman break galaxies around the hot dust-obscured galaxy wise j224607.56$-$052634.9","dejene zewdie (udp), roberto j. assef, chiara mazzucchelli, manuel aravena, andrew w. blain, tanio díaz-santos, peter r. m. eisenhardt, hyunsung d. jun, daniel stern, chao-wei tsai, ""and"" jingwen w. wu","astrophysics of galaxies (astro-ph.ga)","we report the identification of lyman break galaxy (lbg) candidates around the most luminous hot dust-obscured galaxy (hot dog) known, wise j224607.56$-$052634.9 (w2246$-$0526) at $z=4.601$, using deep \textit{r}-, \textit{i}-, and \textit{z}-band imaging from the gemini multi-object spectrograph south (gmos-s). we use the surface density of lbgs to probe the mpc-scale environment of w2246$-$0526 to characterize its richness and evolutionary state. we identify lbg candidates in the vicinity of w2246$-$0526 using the selection criteria developed by \cite{2004vouchi} and \cite{2006yoshida} in the subaru deep field and in the subaru xmm-newton deep field, slightly modified to account for the difference between the filters used, and we find 37 and 55 lbg candidates, respectively. matching to the $z$-band depths of those studies, this corresponds to $\delta = 5.8^{+2.4}_{-1.9}$ times the surface density of lbgs expected in the field. interestingly, the hot dog itself, as well as a confirmed neighbor, do not satisfy either lbg selection criteria, suggesting we may be missing a large number of companion galaxies. our analysis shows that we are most likely only finding those with higher-than-average igm optical depth or moderately high dust obscuration. the number density of lbg candidates is not concentrated around w2246$-$0526, suggesting either an early evolutionary stage for the proto-cluster or that the hot dog may not be the most massive galaxy, or that the hot dog may be affecting the igm transparency in its vicinity. the overdensity around w2246$-$0526 is comparable to overdensities found around other hot dogs and is somewhat higher than typically found for radio galaxies and luminous quasars at a similar redshift.","thu, 29 jun 2023 17:59:11 utc (3,723 kb)"
"67","transforming a quadruped into a guide robot for the visually impaired: formalizing wayfinding, interaction modeling, and safety mechanism","j. taery kim, wenhao yu, yash kothari, jie tan, greg turk, sehoon ha","robotics (cs.ro)","this paper explores the principles for transforming a quadrupedal robot into a guide robot for individuals with visual impairments. a guide robot has great potential to resolve the limited availability of guide animals that are accessible to only two to three percent of the potential blind or visually impaired (bvi) users. to build a successful guide robot, our paper explores three key topics: (1) formalizing the navigation mechanism of a guide dog and a human, (2) developing a data-driven model of their interaction, and (3) improving user safety. first, we formalize the wayfinding task of the human-guide robot team using markov decision processes based on the literature and interviews. then we collect real human-robot interaction data from three visually impaired and six sighted people and develop an interaction model called the ``delayed harness'' to effectively simulate the navigation behaviors of the team. additionally, we introduce an action shielding mechanism to enhance user safety by predicting and filtering out dangerous actions. we evaluate the developed interaction model and the safety mechanism in simulation, which greatly reduce the prediction errors and the number of collisions, respectively. we also demonstrate the integrated system on a quadrupedal robot with a rigid harness, by guiding users over $100+$~m trajectories.","sat, 24 jun 2023 20:47:36 utc (35,082 kb)"
"68","language-guided generation of physically realistic robot motion and control","shusheng xu, huaijie wang, jiaxuan gao, yutao ouyang, chao yu, yi wu","robotics (cs.ro)","we aim to control a robot to physically behave in the real world following any high-level language command like ""cartwheel"" or ""kick. "" although human motion datasets exist, this task remains particularly challenging since generative models can produce physically unrealistic motions, which will be more severe for robots due to different body structures and physical properties. in addition, to control a physical robot to perform a desired motion, a control policy must be learned. we develop language-guided motion control (lagoon), a multi-phase method to generate physically realistic robot motions under language commands. lagoon first leverages a pre-trained model to generate human motion from a language command. then an rl phase is adopted to train a control policy in simulation to mimic the generated human motion. finally, with domain randomization, we show that our learned policy can be successfully deployed to a quadrupedal robot, leading to a robot dog that can stand up and wave its front legs in the real world to mimic the behavior of a hand-waving human.","sun, 18 jun 2023 10:28:48 utc (22,021 kb)"
"69","meta-personalizing vision-language models to find named instances in video","chun-hsiao yeh, bryan russell, josef sivic, fabian caba heilbron, simon jenni","computer vision and pattern recognition (cs.cv)","large-scale vision-language models (vlm) have shown impressive results for language-guided search applications. while these models allow category-level queries, they currently struggle with personalized searches for moments in a video where a specific object instance such as ``my dog biscuit'' appears. we present the following three contributions to address this problem. first, we describe a method to meta-personalize a pre-trained vlm, i.e., learning how to learn to personalize a vlm at test time to search in video. our method extends the vlm's token vocabulary by learning novel word embeddings specific to each instance. to capture only instance-specific features, we represent each instance embedding as a combination of shared and learned global category features. second, we propose to learn such personalization without explicit human supervision. our approach automatically identifies moments of named visual instances in video using transcripts and vision-language similarity in the vlm's embedding space. finally, we introduce this-is-my, a personal video instance retrieval benchmark. we evaluate our approach on this-is-my and deepfashion2 and show that we obtain a 15% relative improvement over the state of the art on the latter dataset.","fri, 16 jun 2023 20:12:11 utc (5,390 kb)"
"70","simplified temporal consistency reinforcement learning","yi zhao, wenshuai zhao, rinu boney, juho kannala, joni pajarinen","machine learning (cs.lg)","reinforcement learning is able to solve complex sequential decision-making tasks but is currently limited by sample efficiency and required computation. to improve sample efficiency, recent work focuses on model-based rl which interleaves model learning with planning. recent methods further utilize policy learning, value estimation, and, self-supervised learning as auxiliary objectives. in this paper we show that, surprisingly, a simple representation learning approach relying only on a latent dynamics model trained by latent temporal consistency is sufficient for high-performance rl. this applies when using pure planning with a dynamics model conditioned on the representation, but, also when utilizing the representation as policy and value function features in model-free rl. in experiments, our approach learns an accurate dynamics model to solve challenging high-dimensional locomotion tasks with online planners while being 4.1 times faster to train compared to ensemble-based methods. with model-free rl without planning, especially on high-dimensional tasks, such as the deepmind control suite humanoid and dog tasks, our approach outperforms model-free methods by a large margin and matches model-based methods' sample efficiency while training 2.4 times faster.","thu, 15 jun 2023 19:37:43 utc (1,112 kb)"
"71","""are you telling me to put glasses on the dog?'' content-grounded annotation of instruction clarification requests in the codraw dataset","brielen madureira, david schlangen","computation and language (cs.cl)","instruction clarification requests are a mechanism to solve communication problems, which is very functional in instruction-following interactions. recent work has argued that the codraw dataset is a valuable source of naturally occurring icrs. beyond identifying when icrs should be made, dialogue models should also be able to generate them with suitable form and content. in this work, we introduce codraw-icr (v2), extending the existing icr identifiers with fine-grained information grounded in the underlying dialogue game items and possible actions. our annotation can serve to model and evaluate repair capabilities of dialogue agents.","sun, 4 jun 2023 15:23:16 utc (8,111 kb)[v2] wed, 26 jul 2023 08:54:03 utc (8,112 kb)"
"72","barkour: benchmarking animal-level agility with quadruped robots","ken caluwaerts, atil iscen, j. chase kew, wenhao yu, tingnan zhang, daniel freeman, kuang-huei lee, lisa lee, stefano saliceti, vincent zhuang, nathan batchelor, steven bohez, federico casarini, jose enrique chen, omar cortes, erwin coumans, adil dostmohamed, gabriel dulac-arnold, alejandro escontrela, erik frey, roland hafner, deepali jain, bauyrjan jyenis, yuheng kuang, edward lee, linda luu, ofir nachum, ken oslund, jason powell, diego reyes, francesco romano, feresteh sadeghi, ron sloat, baruch tabanpour, daniel zheng, michael neunert, raia hadsell, nicolas heess, francesco nori, jeff seto, carolina parada, vikas sindhwani, vincent vanhoucke, jie tan","robotics (cs.ro)","animals have evolved various agile locomotion strategies, such as sprinting, leaping, and jumping. there is a growing interest in developing legged robots that move like their biological counterparts and show various agile skills to navigate complex environments quickly. despite the interest, the field lacks systematic benchmarks to measure the performance of control policies and hardware in agility. we introduce the barkour benchmark, an obstacle course to quantify agility for legged robots. inspired by dog agility competitions, it consists of diverse obstacles and a time based scoring mechanism. this encourages researchers to develop controllers that not only move fast, but do so in a controllable and versatile way. to set strong baselines, we present two methods for tackling the benchmark. in the first approach, we train specialist locomotion skills using on-policy reinforcement learning methods and combine them with a high-level navigation controller. in the second approach, we distill the specialist skills into a transformer-based generalist locomotion policy, named locomotion-transformer, that can handle various terrains and adjust the robot's gait based on the perceived environment and robot states. using a custom-built quadruped robot, we demonstrate that our method can complete the course at half the speed of a dog. we hope that our work represents a step towards creating controllers that enable robots to reach animal-level agility.","wed, 24 may 2023 02:49:43 utc (10,159 kb)"
"73","discovery of a low-redshift hot dust-obscured galaxy","guodong li, chao-wei tsai, daniel stern, jingwen wu, roberto j. assef, andrew w. blain, tanio díaz-santos, peter r. m. eisenhardt, roger l. griffith, thomas h. jarrett, hyunsung d. jun, sean e. lake, m. lynne saade","astrophysics of galaxies (astro-ph.ga)","we report the discovery of the hyperluminous, highly obscured agn wise j190445.04+485308.9 (w1904+4853 hereafter, $l_{bol} = 1.1 \times 10^{13} \ l_{\odot}$) at z=0.415. its well-sampled spectral energy distribution (sed) is dominated by infrared dust emission, though broad emission lines are detected in the optical spectra. these features suggest that w1904+4853 contains an actively accreting supermassive black hole hidden in its dusty cocoon, resembling the observed properties of hot dust-obscured galaxies (hot dogs), a population previously only identified at z>1.0. using the broad component of the mgii emission line, we estimate a black hole mass of $log \ (m_{bh}/m_{\odot}) = 8.4 \pm 0.4$. the corresponding eddington ratio of 1.4 implies that the central black hole accretion is at the theoretical limit of isotropic accretion. the rest-frame uv-optical sed also indicates that the host galaxy of w1904+4853 harbors strong star formation activity at the rate of $6-84 \ m_{\odot} \ \rm{yr^{-1}}$ with an independent estimate of sfr up to $\sim 45 \ m_{\odot} \ \rm{yr^{-1}}$ using the [o ii] emission line. with an estimated stellar mass of $3 \times 10^{10} \ m_{\odot}$, the host galaxy appears to be a starburst system with respect to the main sequence of the star-forming galaxies at the same redshift. although blueshifted and asymmetric [o iii] emission provides evidence of an outflow, we estimate it to be an order of magnitude smaller than the star formation rate, indicating that the current obscured agn activity at the center has not yet produced significant feedback on the host galaxy star formation activity. w1904+4853 supports the interpretation that hot dogs are a rare transitional phase of agn accretion in galaxy evolution, a phase that can persist into the present-day universe.","tue, 23 may 2023 06:46:09 utc (555 kb)[v2] thu, 6 jul 2023 19:08:10 utc (3,697 kb)[v3] tue, 21 nov 2023 21:32:11 utc (2,566 kb)"
"74","susana distancia is all you need: enforcing class separability in metric learning via two novel distance-based loss functions for few-shot image classification","mauricio mendez-ruiz, jorge gonzalez-zapata, ivan reyes-amezcua, daniel flores-araiza, francisco lopez-tiro, andres mendez-vazquez, gilberto ochoa-ruiz","computer vision and pattern recognition (cs.cv)","few-shot learning is a challenging area of research that aims to learn new concepts with only a few labeled samples of data. recent works based on metric-learning approaches leverage the meta-learning approach, which is encompassed by episodic tasks that make use a support (training) and query set (test) with the objective of learning a similarity comparison metric between those sets. due to the lack of data, the learning process of the embedding network becomes an important part of the few-shot task. previous works have addressed this problem using metric learning approaches, but the properties of the underlying latent space and the separability of the difference classes on it was not entirely enforced. in this work, we propose two different loss functions which consider the importance of the embedding vectors by looking at the intra-class and inter-class distance between the few data. the first loss function is the proto-triplet loss, which is based on the original triplet loss with the modifications needed to better work on few-shot scenarios. the second loss function, which we dub icnn loss is based on an inter and intra class nearest neighbors score, which help us to assess the quality of embeddings obtained from the trained network. our results, obtained from a extensive experimental setup show a significant improvement in accuracy in the miniimagennet benchmark compared to other metric-based few-shot learning methods by a margin of 2%, demonstrating the capability of these loss functions to allow the network to generalize better to previously unseen classes. in our experiments, we demonstrate competitive generalization capabilities to other domains, such as the caltech cub, dogs and cars datasets compared with the state of the art.","mon, 15 may 2023 23:12:09 utc (10,028 kb)[v2] wed, 17 may 2023 00:58:41 utc (10,028 kb)[v3] thu, 18 may 2023 20:41:34 utc (10,028 kb)"
"75","reconstructing animatable categories from videos","gengshan yang, chaoyang wang, n dinesh reddy, deva ramanan","computer vision and pattern recognition (cs.cv)","building animatable 3d models is challenging due to the need for 3d scans, laborious registration, and manual rigging, which are difficult to scale to arbitrary categories. recently, differentiable rendering provides a pathway to obtain high-quality 3d models from monocular videos, but these are limited to rigid categories or single instances. we present rac that builds category 3d models from monocular videos while disentangling variations over instances and motion over time. three key ideas are introduced to solve this problem: (1) specializing a skeleton to instances via optimization, (2) a method for latent space regularization that encourages shared structure across a category while maintaining instance details, and (3) using 3d background models to disentangle objects from the background. we show that 3d models of humans, cats, and dogs can be learned from 50-100 internet videos.","wed, 10 may 2023 17:56:21 utc (90,604 kb)"
"76","quantifying uncertainties on the tip of the red giant branch method","barry f. madore, wendy l. freedman kayla a. owens, in sung jang","solar and stellar astrophysics (astro-ph.sr)","we present an extensive grid of numerical simulations quantifying the uncertainties in measurements of the tip of the red giant branch (trgb). these simulations incorporate a luminosity function composed of 2 magnitudes of red giant branch (rgb) stars leading up to the tip, with asymptotic giant branch (agb) stars contributing exclusively to the luminosity function for at least a magnitude above the rgb tip. we quantify the sensitivity of the trgb detection and measurement to three important error sources: (1) the sample size of stars near the tip, (2) the photometric measurement uncertainties at the tip, and (3) the degree of self-crowding of the rgb population. the self-crowding creates a population of supra-trgb stars due to the blending of one or more rgb stars just below the tip. this last population is ultimately difficult, though still possible, to disentangle from true agb stars. in the analysis given here, the precepts and general methodology as used in the chicago-carnegie hubble program (cchp) has been followed. however, in the appendix, we introduce and test a set of new tip detection kernels which internally incorporate self-consistent smoothing. these are generalizations of the two-step model used by the cchp (smoothing followed by sobel-filter tip detection), where the new kernels are based on successive binomial-coefficient approximations to the derivative-of-a-gaussian (dog) edge detector, as is commonly used in modern digital image processing.","wed, 10 may 2023 14:27:03 utc (27,463 kb)"
"77","personalize segment anything model with one shot","renrui zhang, zhengkai jiang, ziyu guo, shilin yan, junting pan, xianzheng ma, hao dong, peng gao, hongsheng li","computer vision and pattern recognition (cs.cv)","driven by large-data pre-training, segment anything model (sam) has been demonstrated as a powerful and promptable framework, revolutionizing the segmentation models. despite the generality, customizing sam for specific visual concepts without man-powered prompting is under explored, e.g., automatically segmenting your pet dog in different images. in this paper, we propose a training-free personalization approach for sam, termed as persam. given only a single image with a reference mask, persam first localizes the target concept by a location prior, and segments it within other images or videos via three techniques: target-guided attention, target-semantic prompting, and cascaded post-refinement. in this way, we effectively adapt sam for private use without any training. to further alleviate the mask ambiguity, we present an efficient one-shot fine-tuning variant, persam-f. freezing the entire sam, we introduce two learnable weights for multi-scale masks, only training 2 parameters within 10 seconds for improved performance. to demonstrate our efficacy, we construct a new segmentation dataset, perseg, for personalized evaluation, and test our methods on video object segmentation with competitive performance. besides, our approach can also enhance dreambooth to personalize stable diffusion for text-to-image generation, which discards the background disturbance for better target appearance learning. code is released at this https url","thu, 4 may 2023 17:59:36 utc (39,764 kb)[v2] wed, 4 oct 2023 01:15:21 utc (32,396 kb)"
"78","lostpaw: finding lost pets using a contrastive learning-based transformer with visual input","andrei voinea, robin kock, maruf a. dhali","computer vision and pattern recognition (cs.cv)","losing pets can be highly distressing for pet owners, and finding a lost pet is often challenging and time-consuming. an artificial intelligence-based application can significantly improve the speed and accuracy of finding lost pets. in order to facilitate such an application, this study introduces a contrastive neural network model capable of accurately distinguishing between images of pets. the model was trained on a large dataset of dog images and evaluated through 3-fold cross-validation. following 350 epochs of training, the model achieved a test accuracy of 90%. furthermore, overfitting was avoided, as the test accuracy closely matched the training accuracy. our findings suggest that contrastive neural network models hold promise as a tool for locating lost pets. this paper provides the foundation for a potential web application that allows users to upload images of their missing pets, receiving notifications when matching images are found in the application's image database. this would enable pet owners to quickly and accurately locate lost pets and reunite them with their families.","fri, 28 apr 2023 11:23:44 utc (4,889 kb)"
"79","slomo: a general system for legged robot motion imitation from casual videos","john z. zhang, shuo yang, gengshan yang, arun l. bishop, deva ramanan, zachary manchester","robotics (cs.ro)","we present slomo: a first-of-its-kind framework for transferring skilled motions from casually captured ""in the wild"" video footage of humans and animals to legged robots. slomo works in three stages: 1) synthesize a physically plausible reconstructed key-point trajectory from monocular videos; 2) optimize a dynamically feasible reference trajectory for the robot offline that includes body and foot motion, as well as contact sequences that closely tracks the key points; 3) track the reference trajectory online using a general-purpose model-predictive controller on robot hardware. traditional motion imitation for legged motor skills often requires expert animators, collaborative demonstrations, and/or expensive motion capture equipment, all of which limits scalability. instead, slomo only relies on easy-to-obtain monocular video footage, readily available in online repositories such as youtube. it converts videos into motion primitives that can be executed reliably by real-world robots. we demonstrate our approach by transferring the motions of cats, dogs, and humans to example robots including a quadruped (on hardware) and a humanoid (in simulation). to the best knowledge of the authors, this is the first attempt at a general-purpose motion transfer framework that imitates animal and human motions on legged robots directly from casual videos without artificial markers or labels.","thu, 27 apr 2023 17:53:27 utc (42,614 kb)[v2] tue, 5 sep 2023 13:45:16 utc (7,802 kb)"
