"","titles","authors","subjects","abstracts","metadata"
"34","quantum learning and essential cognition under the traction of meta-characteristics in an open world","jin wang, changlin song","artificial intelligence (cs.ai)","artificial intelligence has made significant progress in the close world problem, being able to accurately recognize old knowledge through training and classification. however, ai faces significant challenges in the open world problem, as it involves a new and unknown exploration journey. ai is not inherently proactive in exploration, and its challenge lies in not knowing how to approach and adapt to the unknown world. how do humans acquire knowledge of the unknown world. humans identify new knowledge through intrinsic cognition. in the process of recognizing new colors, the cognitive cues are different from known color features and involve hue, saturation, brightness, and other characteristics. when ai encounters objects with different features in the new world, it faces another challenge: where are the distinguishing features between influential features of new and old objects? ai often mistakes a new world's brown bear for a known dog because it has not learned the differences in feature distributions between knowledge systems. this is because things in the new and old worlds have different units and dimensions for their features. this paper proposes an open-world model and elemental feature system that focuses on fundamentally recognizing the distribution differences in objective features between the new and old worlds. the quantum tunneling effect of learning ability in the new and old worlds is realized through the tractive force of meta-characteristic. the outstanding performance of the model system in learning new knowledge (using pedestrian re-identification datasets as an example) demonstrates that ai has acquired the ability to recognize the new world with an accuracy of $96.71\%$ at most and has gained the capability to explore new knowledge, similar to humans.","wed, 22 nov 2023 11:55:41 utc (11,284 kb)"
"35","das: a deformable attention to capture salient information in cnns","farzad salajegheh, nader asadi, soroush saryazdi, sudhir mudur","computer vision and pattern recognition (cs.cv)","convolutional neural networks (cnns) excel in local spatial pattern recognition. for many vision tasks, such as object recognition and segmentation, salient information is also present outside cnn's kernel boundaries. however, cnns struggle in capturing such relevant information due to their confined receptive fields. self-attention can improve a model's access to global information but increases computational overhead. we present a fast and simple fully convolutional method called das that helps focus attention on relevant information. it uses deformable convolutions for the location of pertinent image regions and separable convolutions for efficiency. das plugs into existing cnns and propagates relevant information using a gating mechanism. compared to the o(n^2) computational complexity of transformer-style attention, das is o(n). our claim is that das's ability to pay increased attention to relevant features results in performance improvements when added to popular cnns for image classification and object detection. for example, das yields an improvement on stanford dogs (4.47%), imagenet (1.91%), and coco ap (3.3%) with base resnet50 backbone. this outperforms other cnn attention mechanisms while using similar or less flops. our code will be publicly available.","mon, 20 nov 2023 18:49:58 utc (13,040 kb)"
"36","categorizing the visual environment and analyzing the visual attention of dogs","shreyas sundara raman, madeline h. pelgrim, daphna buchsbaum, thomas serre","computer vision and pattern recognition (cs.cv)","dogs have a unique evolutionary relationship with humans and serve many important roles e.g. search and rescue, blind assistance, emotional support. however, few datasets exist to categorize visual features and objects available to dogs, as well as how dogs direct their visual attention within their environment. we collect and study a dataset with over 11,698 gazes to categorize the objects available to be gazed at by 11 dogs in everyday outdoor environments i.e. a walk around a college campus and urban area. we explore the availability of these object categories and the visual attention of dogs over these categories using a head mounted eye tracking apparatus. a small portion (approx. 600 images or < 20% of total dataset) of the collected data is used to fine tune a maskrcnn for the novel image domain to segment objects present in the scene, enabling further statistical analysis on the visual gaze tendencies of dogs. the maskrcnn, with eye tracking apparatus, serves as an end to end model for automatically classifying the visual fixations of dogs. the fine tuned maskrcnn performs far better than chance. there are few individual differences between the 11 dogs and we observe greater visual fixations on buses, plants, pavement, and construction equipment. this work takes a step towards understanding visual behavior of dogs and their interaction with the physical world.","mon, 20 nov 2023 18:21:18 utc (5,248 kb)"
"37","data center audio/video intelligence on device (david) -- an edge-ai platform for smart-toys","gabriel cosache, francisco salgado, cosmin rotariu, george sterpu, rishabh jain, peter corcoran","artificial intelligence (cs.ai)","an overview is given of the david smart-toy platform, one of the first edge ai platform designs to incorporate advanced low-power data processing by neural inference models co-located with the relevant image or audio sensors. there is also on-board capability for in-device text-to-speech generation. two alternative embodiments are presented: a smart teddy-bear, and a roving dog-like robot. the platform offers a speech-driven user interface and can observe and interpret user actions and facial expressions via its computer vision sensor node. a particular benefit of this design is that no personally identifiable information passes beyond the neural inference nodes thus providing inbuilt compliance with data protection regulations.","sat, 18 nov 2023 10:38:35 utc (3,375 kb)"
"38","neural networks are implicit decision trees: the hierarchical simplicity bias","zhehang du","machine learning (cs.lg)","neural networks exhibit simplicity bias; they rely on simpler features while ignoring equally predictive but more complex features. in this work, we introduce a novel approach termed imbalanced label coupling to investigate scenarios where simple and complex features exhibit different levels of predictive power. in these cases, complex features still contribute to predictions. the trained networks make predictions in alignment with the ascending complexity of input features according to how they correlate with the label in the training set, irrespective of the underlying predictive power. for instance, even when simple spurious features distort predictions in cifar-10, most cats are predicted to be dogs, and most trucks are predicted to be automobiles! this observation provides direct evidence that the neural network learns core features in the presence of spurious features. we empirically show that last-layer retraining with target data distribution is effective, yet insufficient to fully recover core features when spurious features are perfectly correlated with the target labels in our synthetic dataset. we hope our research contributes to a deeper understanding of the implicit bias of neural networks.","sun, 5 nov 2023 11:27:03 utc (580 kb)"
"39","see sift in a rain","wei wu, hao chang, zhu li","image and video processing (eess.iv)","rain streaks bring complicated pixel intensity changes and additional gradients, greatly obstructing the extraction of image features from background. this causes serious performance degradation in feature-based applications. thus, it is critical to remove rain streaks from a single rainy image to recover image features. recently, many excellent image deraining methods have made remarkable progress. however, these human visual system-driven approaches mainly focus on improving image quality with pixel recovery as loss function, and neglect how to enhance image feature recovery ability. to address this issue, we propose a task-driven image deraining algorithm to strengthen image feature supply for subsequent feature-based applications. due to the extensive use and strong practicability of scale-invariant feature transform (sift), we first propose two separate networks using distinct losses and modules to achieve two goals, respectively. one is difference of gaussian (dog) pyramid recovery network (dprnet) for sift detection, and the other gradients of gaussian images recovery network (ggirnet) for sift description. second, in the dprnet we propose an alternative interest point loss that directly penalizes scale response extrema to recover the dog pyramid. third, we advance a gradient attention module in the ggirnet to recover those gradients of gaussian images. finally, with the recovered dog pyramid and gradients, we can regain sift key points. this divide-and-conquer scheme to set different objectives for sift detection and description leads to good robustness. compared with state-of-the-art methods, experimental results demonstrate that our proposed algorithm achieves better performance in both the number of recovered sift key points and their accuracy.","wed, 1 nov 2023 13:42:23 utc (1,959 kb)"
"40","what's ""up"" with vision-language models? investigating their struggle with spatial reasoning","amita kamath, jack hessel, kai-wei chang","computation and language (cs.cl)","recent vision-language (vl) models are powerful, but can they reliably distinguish ""right"" from ""left""? we curate three new corpora to quantify model comprehension of such basic spatial relations. these tests isolate spatial reasoning more precisely than existing datasets like vqav2, e.g., our what'sup benchmark contains sets of photographs varying only the spatial relations of objects, keeping their identity fixed (see figure 1: models must comprehend not only the usual case of a dog under a table, but also, the same dog on top of the same table). we evaluate 18 vl models, finding that all perform poorly, e.g., blip finetuned on vqav2, which nears human parity on vqav2, achieves 56% accuracy on our benchmarks vs. humans at 99%. we conclude by studying causes of this surprising behavior, finding: 1) that popular vision-language pretraining corpora like laion-2b contain little reliable data for learning spatial relationships; and 2) that basic modeling interventions like up-weighting preposition-containing instances or fine-tuning on our corpora are not sufficient to address the challenges our benchmarks pose. we are hopeful that these corpora will facilitate further research, and we release our data and code at this https url.","mon, 30 oct 2023 17:50:15 utc (13,534 kb)"
"41","drm: mastering visual reinforcement learning through dormant ratio minimization","guowei xu, ruijie zheng, yongyuan liang, xiyao wang, zhecheng yuan, tianying ji, yu luo, xiaoyu liu, jiaxin yuan, pu hua, shuzhen li, yanjie ze, hal daumé iii, furong huang, huazhe xu","machine learning (cs.lg)","visual reinforcement learning (rl) has shown promise in continuous control tasks. despite its progress, current algorithms are still unsatisfactory in virtually every aspect of the performance such as sample efficiency, asymptotic performance, and their robustness to the choice of random seeds. in this paper, we identify a major shortcoming in existing visual rl methods that is the agents often exhibit sustained inactivity during early training, thereby limiting their ability to explore effectively. expanding upon this crucial observation, we additionally unveil a significant correlation between the agents' inclination towards motorically inactive exploration and the absence of neuronal activity within their policy networks. to quantify this inactivity, we adopt dormant ratio as a metric to measure inactivity in the rl agent's network. empirically, we also recognize that the dormant ratio can act as a standalone indicator of an agent's activity level, regardless of the received reward signals. leveraging the aforementioned insights, we introduce drm, a method that uses three core mechanisms to guide agents' exploration-exploitation trade-offs by actively minimizing the dormant ratio. experiments demonstrate that drm achieves significant improvements in sample efficiency and asymptotic performance with no broken seeds (76 seeds in total) across three continuous control benchmark environments, including deepmind control suite, metaworld, and adroit. most importantly, drm is the first model-free algorithm that consistently solves tasks in both the dog and manipulator domains from the deepmind control suite as well as three dexterous hand manipulation tasks without demonstrations in adroit, all based on pixel observations.","mon, 30 oct 2023 15:50:56 utc (3,716 kb)[v2] wed, 14 feb 2024 03:56:25 utc (3,582 kb)"
"42","on the theory of risk-aware agents: bridging actor-critic and economics","michal nauman, marek cygan","machine learning (cs.lg)","risk-aware reinforcement learning (rl) algorithms like sac and td3 were shown empirically to outperform their risk-neutral counterparts in a variety of continuous-action tasks. however, the theoretical basis for the pessimistic objectives these algorithms employ remains unestablished, raising questions about the specific class of policies they are implementing. in this work, we apply the expected utility hypothesis, a fundamental concept in economics, to illustrate that both risk-neutral and risk-aware rl goals can be interpreted through expected utility maximization using an exponential utility function. this approach reveals that risk-aware policies effectively maximize value certainty equivalent, aligning them with conventional decision theory principles. furthermore, we propose dual actor-critic (dac). dac is a risk-aware, model-free algorithm that features two distinct actor networks: a pessimistic actor for temporal-difference learning and an optimistic actor for exploration. our evaluations of dac across various locomotion and manipulation tasks demonstrate improvements in sample efficiency and final performance. remarkably, dac, while requiring significantly less computational resources, matches the performance of leading model-based methods in the complex dog and humanoid domains.","mon, 30 oct 2023 13:28:06 utc (10,288 kb)[v2] sat, 2 mar 2024 12:40:15 utc (34,597 kb)"
"43","attribute based interpretable evaluation metrics for generative models","dongkyun kim, mingi kwon, youngjung uh","computer vision and pattern recognition (cs.cv)","when the training dataset comprises a 1:1 proportion of dogs to cats, a generative model that produces 1:1 dogs and cats better resembles the training species distribution than another model with 3:1 dogs and cats. can we capture this phenomenon using existing metrics? unfortunately, we cannot, because these metrics do not provide any interpretability beyond ""diversity"". in this context, we propose a new evaluation protocol that measures the divergence of a set of generated images from the training set regarding the distribution of attribute strengths as follows. single-attribute divergence (sad) measures the divergence regarding pdfs of a single attribute. paired-attribute divergence (pad) measures the divergence regarding joint pdfs of a pair of attributes. they provide which attributes the models struggle. for measuring the attribute strengths of an image, we propose heterogeneous clipscore (hcs) which measures the cosine similarity between image and text vectors with heterogeneous initial points. with sad and pad, we reveal the following about existing generative models. projectedgan generates implausible attribute relationships such as a baby with a beard even though it has competitive scores of existing metrics. diffusion models struggle to capture diverse colors in the datasets. the larger sampling timesteps of latent diffusion model generate the more minor objects including earrings and necklaces. stable diffusion v1.5 better captures the attributes than v2.1. our metrics lay a foundation for explainable evaluations of generative models.","thu, 26 oct 2023 09:25:09 utc (28,659 kb)"
"44","federated quantum machine learning with differential privacy","rod rofougaran, shinjae yoo, huan-hsin tseng, samuel yen-chi chen","quantum physics (quant-ph)","the preservation of privacy is a critical concern in the implementation of artificial intelligence on sensitive training data. there are several techniques to preserve data privacy but quantum computations are inherently more secure due to the no-cloning theorem, resulting in a most desirable computational platform on top of the potential quantum advantages. there have been prior works in protecting data privacy by quantum federated learning (qfl) and quantum differential privacy (qdp) studied independently. however, to the best of our knowledge, no prior work has addressed both qfl and qdp together yet. here, we propose to combine these privacy-preserving methods and implement them on the quantum platform, so that we can achieve comprehensive protection against data leakage (qfl) and model inversion attacks (qdp). this implementation promises more efficient and secure artificial intelligence. in this paper, we present a successful implementation of these privacy-preservation methods by performing the binary classification of the cats vs dogs dataset. using our quantum-classical machine learning model, we obtained a test accuracy of over 0.98, while maintaining epsilon values less than 1.3. we show that federated differentially private training is a viable privacy preservation method for quantum machine learning on noisy intermediate-scale quantum (nisq) devices.","tue, 10 oct 2023 19:52:37 utc (2,090 kb)"
"45","blind dates: examining the expression of temporality in historical photographs","alexandra barancová, melvin wevers, nanne van noord","computer vision and pattern recognition (cs.cv)","this paper explores the capacity of computer vision models to discern temporal information in visual content, focusing specifically on historical photographs. we investigate the dating of images using openclip, an open-source implementation of clip, a multi-modal language and vision model. our experiment consists of three steps: zero-shot classification, fine-tuning, and analysis of visual content. we use the \textit{de boer scene detection} dataset, containing 39,866 gray-scale historical press photographs from 1950 to 1999. the results show that zero-shot classification is relatively ineffective for image dating, with a bias towards predicting dates in the past. fine-tuning openclip with a logistic classifier improves performance and eliminates the bias. additionally, our analysis reveals that images featuring buses, cars, cats, dogs, and people are more accurately dated, suggesting the presence of temporal markers. the study highlights the potential of machine learning models like openclip in dating images and emphasizes the importance of fine-tuning for accurate temporal analysis. future research should explore the application of these findings to color photographs and diverse datasets.","tue, 10 oct 2023 13:51:24 utc (1,180 kb)"
"46","towards lexical analysis of dog vocalizations via online videos","yufei wang, chunhao zhang, jieyi huang, mengyue wu, kenny zhu","sound (cs.sd)","deciphering the semantics of animal language has been a grand challenge. this study presents a data-driven investigation into the semantics of dog vocalizations via correlating different sound types with consistent semantics. we first present a new dataset of shiba inu sounds, along with contextual information such as location and activity, collected from youtube with a well-constructed pipeline. the framework is also applicable to other animal species. based on the analysis of conditioned probability between dog vocalizations and corresponding location and activity, we discover supporting evidence for previous heuristic research on the semantic meaning of various dog sounds. for instance, growls can signify interactions. furthermore, our study yields new insights that existing word types can be subdivided into finer-grained subtypes and minimal semantic unit for shiba inu is word-related. for example, whimper can be subdivided into two types, attention-seeking and discomfort.","thu, 21 sep 2023 23:53:14 utc (28,992 kb)"
"47","does my dog ''speak'' like me? the acoustic correlation between pet dogs and their human owners","jieyi huang, chunhao zhang, yufei wang, mengyue wu, kenny zhu","sound (cs.sd)","how hosts language influence their pets' vocalization is an interesting yet underexplored problem. this paper presents a preliminary investigation into the possible correlation between domestic dog vocal expressions and their human host's language environment. we first present a new dataset of shiba inu dog vocals from youtube, which provides 7500 clean sound clips, including their contextual information of these vocals and their owner's speech clips with a carefully-designed data processing pipeline. the contextual information includes the scene category in which the vocal was recorded, the dog's location and activity. with a classification task and prominent factor analysis, we discover significant acoustic differences in the dog vocals from the two language environments. we further identify some acoustic features from dog vocalizations that are potentially correlated to their host language patterns.","thu, 21 sep 2023 23:49:21 utc (14,599 kb)"
"48","visible and nir image fusion algorithm based on information complementarity","zhuo li, bo li","computer vision and pattern recognition (cs.cv)","visible and near-infrared(nir) band sensors provide images that capture complementary spectral radiations from a scene. and the fusion of the visible and nir image aims at utilizing their spectrum properties to enhance image quality. however, currently visible and nir fusion algorithms cannot well take advantage of spectrum properties, as well as lack information complementarity, which results in color distortion and artifacts. therefore, this paper designs a complementary fusion model from the level of physical signals. first, in order to distinguish between noise and useful information, we use two layers of the weight-guided filter and guided filter to obtain texture and edge layers, respectively. second, to generate the initial visible-nir complementarity weight map, the difference maps of visible and nir are filtered by the extend-dog filter. after that, the significant region of nir night-time compensation guides the initial complementarity weight map by the arctani function. finally, the fusion images can be generated by the complementarity weight maps of visible and nir images, respectively. the experimental results demonstrate that the proposed algorithm can not only well take advantage of the spectrum properties and the information complementarity, but also avoid color unnatural while maintaining naturalness, which outperforms the state-of-the-art.","tue, 19 sep 2023 11:07:24 utc (3,889 kb)"
"49","where do free-ranging dogs rest? a population level study reveals hidden patterns in resting site choice","sourabh biswas, kalyan ghosh, kaushikee sarkar, anindita bhadra","populations and evolution (q-bio.pe)","free-ranging dogs (frds) in human-dominated areas encounter obstacles such as noise, pollution, limited food sources, and anthropogenic disturbance while resting. since frds have survived as a population in india, as in many other parts of the global south for centuries, they provide a unique opportunity to study adaptation of animals to the human-dominated urban landscape. we documented factors impacting resting behaviour and site preferences in three states of india, for 284 dogs, leading to 6047 observations over 3 years. 7 physical parameters of the resting sites, along with the biological factors like mating and pup-rearing and time of day affected their choice of resting sites. the frequency-rank distribution of the unique combinations in which the parameters were selected followed a power law distribution, which suggests underlying biological reasons for the observed preferences. further, 3 of these parameters showed maximum consistency of choice in terms of the sub-parameters selected, explaining 30% of the observations. frds prefer to rest close to their resource sites within the territory, at a place that enabled maximum visibility of the surroundings. they chose such sites in the core of the territory for sleeping. at other times, they chose such sites away from the core, and were less restive, thus allowing for immediate response in case of intrusion or threat. they generally avoided anthropogenic disturbance for sleeping, and preferred areas with shade.incorporating these aspects into urban management plans can promote human-dog cooperation and reduce situations of conflict. we envisage more inclusive urban areas in the future, that can allow for co-existence of the humans and their oldest companions in the commensal relationship that has been maintained for hundreds of generations of dogs in this part of the world.","sat, 16 sep 2023 17:33:40 utc (976 kb)"
